{
  "$schema": "./map.schema.json",
  "format": "game-2d/map-sparse-v1",
  "version": 1,
  "name": "Caverna dos Orcs",
  "mapId": "orc_cave",
  "size": 256,
  "tileSize": 32,
  "coordSystem": {
    "origin": "top-left",
    "axisX": "columna — aumenta para leste (direita)",
    "axisY": "linha — aumenta para sul (baixo no canvas)",
    "axisZ": "andar — -7 (subsolo) … 0 (térreo) … +7 (céu)",
    "validZ": {
      "min": -7,
      "max": 7
    },
    "emptyTileId": -1,
    "tileUnit": "cell"
  },
  "tileRefs": {
    "38": {
      "id": 38,
      "name": "01-ground-pedra_variants · 1",
      "ref": "01_ground_pedra_variants#0",
      "category": "ground",
      "variantGroup": "ground",
      "walkable": true,
      "variantIndex": 0
    },
    "39": {
      "id": 39,
      "name": "01-ground-pedra_variants · 2",
      "ref": "01_ground_pedra_variants#1",
      "category": "ground",
      "variantGroup": "ground",
      "walkable": true,
      "variantIndex": 1
    },
    "40": {
      "id": 40,
      "name": "01-ground-pedra_variants · 3",
      "ref": "01_ground_pedra_variants#2",
      "category": "ground",
      "variantGroup": "ground",
      "walkable": true,
      "variantIndex": 2
    },
    "41": {
      "id": 41,
      "name": "01-ground-pedra_variants · 4",
      "ref": "01_ground_pedra_variants#3",
      "category": "ground",
      "variantGroup": "ground",
      "walkable": true,
      "variantIndex": 3
    }
  },
  "spawn": {
    "x": 50,
    "y": 50,
    "z": 0
  },
  "tiles": {
    "0": [
      { "x": 38, "y": 40, "id": 40, "ref": "01_ground_pedra_variants#2" },
      { "x": 39, "y": 40, "id": 40, "ref": "01_ground_pedra_variants#2" },
      { "x": 40, "y": 40, "id": 40, "ref": "01_ground_pedra_variants#2" },
      { "x": 41, "y": 40, "id": 40, "ref": "01_ground_pedra_variants#2" },
      { "x": 42, "y": 40, "id": 40, "ref": "01_ground_pedra_variants#2" },
      { "x": 43, "y": 40, "id": 40, "ref": "01_ground_pedra_variants#2" },
      { "x": 44, "y": 40, "id": 40, "ref": "01_ground_pedra_variants#2" },
      { "x": 45, "y": 40, "id": 38, "ref": "01_ground_pedra_variants#0" },
      { "x": 46, "y": 40, "id": 39, "ref": "01_ground_pedra_variants#1" },
      { "x": 47, "y": 40, "id": 39, "ref": "01_ground_pedra_variants#1" },
      { "x": 48, "y": 40, "id": 38, "ref": "01_ground_pedra_variants#0" },
      { "x": 49, "y": 40, "id": 38, "ref": "01_ground_pedra_variants#0" },
      { "x": 50, "y": 40, "id": 39, "ref": "01_ground_pedra_variants#1" },
      { "x": 36, "y": 41, "id": 41, "ref": "01_ground_pedra_variants#3" },
      { "x": 37, "y": 41, "id": 41, "ref": "01_ground_pedra_variants#3" },
      { "x": 38, "y": 41, "id": 41, "ref": "01_ground_pedra_variants#3" },
      { "x": 39, "y": 41, "id": 41, "ref": "01_ground_pedra_variants#3" },
      { "x": 40, "y": 41, "id": 41, "ref": "01_ground_pedra_variants#3" },
      { "x": 41, "y": 41, "id": 41, "ref": "01_ground_pedra_variants#3" },
      { "x": 42, "y": 41, "id": 41, "ref": "01_ground_pedra_variants#3" },
      { "x": 43, "y": 41, "id": 40, "ref": "01_ground_pedra_variants#2" },
      { "x": 44, "y": 41, "id": 40, "ref": "01_ground_pedra_variants#2" },
      { "x": 45, "y": 41, "id": 38, "ref": "01_ground_pedra_variants#0" },
      { "x": 46, "y": 41, "id": 39, "ref": "01_ground_pedra_variants#1" },
      { "x": 47, "y": 41, "id": 39, "ref": "01_ground_pedra_variants#1" },
      { "x": 48, "y": 41, "id": 38, "ref": "01_ground_pedra_variants#0" },
      { "x": 49, "y": 41, "id": 38, "ref": "01_ground_pedra_variants#0" },
      { "x": 50, "y": 41, "id": 39, "ref": "01_ground_pedra_variants#1" },
      { "x": 51, "y": 41, "id": 40, "ref": "01_ground_pedra_variants#2" },
      { "x": 52, "y": 41, "id": 39, "ref": "01_ground_pedra_variants#1" },
      { "x": 53, "y": 41, "id": 41, "ref": "01_ground_pedra_variants#3" },
      { "x": 54, "y": 41, "id": 38, "ref": "01_ground_pedra_variants#0" },
      { "x": 55, "y": 41, "id": 38, "ref": "01_ground_pedra_variants#0" },
      { "x": 56, "y": 41, "id": 38, "ref": "01_ground_pedra_variants#0" },
      { "x": 34, "y": 42, "id": 40, "ref": "01_ground_pedra_variants#2" },
      { "x": 35, "y": 42, "id": 41, "ref": "01_ground_pedra_variants#3" },
      { "x": 36, "y": 42, "id": 41, "ref": "01_ground_pedra_variants#3" },
      { "x": 37, "y": 42, "id": 41, "ref": "01_ground_pedra_variants#3" },
      { "x": 38, "y": 42, "id": 41, "ref": "01_ground_pedra_variants#3" },
      { "x": 39, "y": 42, "id": 41, "ref": "01_ground_pedra_variants#3" },
      { "x": 40, "y": 42, "id": 41, "ref": "01_ground_pedra_variants#3" },
      { "x": 41, "y": 42, "id": 40, "ref": "01_ground_pedra_variants#2" },
      { "x": 42, "y": 42, "id": 41, "ref": "01_ground_pedra_variants#3" },
      { "x": 43, "y": 42, "id": 40, "ref": "01_ground_pedra_variants#2" },
      { "x": 44, "y": 42, "id": 40, "ref": "01_ground_pedra_variants#2" },
      { "x": 45, "y": 42, "id": 38, "ref": "01_ground_pedra_variants#0" },
      { "x": 46, "y": 42, "id": 39, "ref": "01_ground_pedra_variants#1" },
      { "x": 47, "y": 42, "id": 39, "ref": "01_ground_pedra_variants#1" },
      { "x": 48, "y": 42, "id": 38, "ref": "01_ground_pedra_variants#0" },
      { "x": 49, "y": 42, "id": 38, "ref": "01_ground_pedra_variants#0" },
      { "x": 50, "y": 42, "id": 39, "ref": "01_ground_pedra_variants#1" },
      { "x": 51, "y": 42, "id": 40, "ref": "01_ground_pedra_variants#2" },
      { "x": 52, "y": 42, "id": 39, "ref": "01_ground_pedra_variants#1" },
      { "x": 53, "y": 42, "id": 41, "ref": "01_ground_pedra_variants#3" },
      { "x": 54, "y": 42, "id": 38, "ref": "01_ground_pedra_variants#0" },
      { "x": 55, "y": 42, "id": 38, "ref": "01_ground_pedra_variants#0" },
      { "x": 56, "y": 42, "id": 38, "ref": "01_ground_pedra_variants#0" },
      { "x": 57, "y": 42, "id": 41, "ref": "01_ground_pedra_variants#3" },
      { "x": 32, "y": 43, "id": 40, "ref": "01_ground_pedra_variants#2" },
      { "x": 33, "y": 43, "id": 40, "ref": "01_ground_pedra_variants#2" },
      { "x": 34, "y": 43, "id": 38, "ref": "01_ground_pedra_variants#0" },
      { "x": 35, "y": 43, "id": 38, "ref": "01_ground_pedra_variants#0" },
      { "x": 36, "y": 43, "id": 38, "ref": "01_ground_pedra_variants#0" },
      { "x": 37, "y": 43, "id": 38, "ref": "01_ground_pedra_variants#0" },
      { "x": 38, "y": 43, "id": 38, "ref": "01_ground_pedra_variants#0" },
      { "x": 39, "y": 43, "id": 38, "ref": "01_ground_pedra_variants#0" },
      { "x": 40, "y": 43, "id": 41, "ref": "01_ground_pedra_variants#3" },
      { "x": 41, "y": 43, "id": 40, "ref": "01_ground_pedra_variants#2" },
      { "x": 42, "y": 43, "id": 41, "ref": "01_ground_pedra_variants#3" },
      { "x": 43, "y": 43, "id": 40, "ref": "01_ground_pedra_variants#2" },
      { "x": 44, "y": 43, "id": 40, "ref": "01_ground_pedra_variants#2" },
      { "x": 45, "y": 43, "id": 38, "ref": "01_ground_pedra_variants#0" },
      { "x": 46, "y": 43, "id": 39, "ref": "01_ground_pedra_variants#1" },
      { "x": 47, "y": 43, "id": 39, "ref": "01_ground_pedra_variants#1" },
      { "x": 48, "y": 43, "id": 38, "ref": "01_ground_pedra_variants#0" },
      { "x": 49, "y": 43, "id": 38, "ref": "01_ground_pedra_variants#0" },
      { "x": 50, "y": 43, "id": 39, "ref": "01_ground_pedra_variants#1" },
      { "x": 51, "y": 43, "id": 40, "ref": "01_ground_pedra_variants#2" },
      { "x": 52, "y": 43, "id": 39, "ref": "01_ground_pedra_variants#1" },
      { "x": 53, "y": 43, "id": 41, "ref": "01_ground_pedra_variants#3" },
      { "x": 54, "y": 43, "id": 38, "ref": "01_ground_pedra_variants#0" },
      { "x": 55, "y": 43, "id": 38, "ref": "01_ground_pedra_variants#0" },
      { "x": 56, "y": 43, "id": 38, "ref": "01_ground_pedra_variants#0" },
      { "x": 57, "y": 43, "id": 41, "ref": "01_ground_pedra_variants#3" },
      { "x": 58, "y": 43, "id": 41, "ref": "01_ground_pedra_variants#3" },
      { "x": 31, "y": 44, "id": 38, "ref": "01_ground_pedra_variants#0" },
      { "x": 32, "y": 44, "id": 40, "ref": "01_ground_pedra_variants#2" },
      { "x": 33, "y": 44, "id": 40, "ref": "01_ground_pedra_variants#2" },
      { "x": 34, "y": 44, "id": 41, "ref": "01_ground_pedra_variants#3" },
      { "x": 35, "y": 44, "id": 41, "ref": "01_ground_pedra_variants#3" },
      { "x": 36, "y": 44, "id": 41, "ref": "01_ground_pedra_variants#3" },
      { "x": 37, "y": 44, "id": 41, "ref": "01_ground_pedra_variants#3" },
      { "x": 38, "y": 44, "id": 41, "ref": "01_ground_pedra_variants#3" },
      { "x": 39, "y": 44, "id": 41, "ref": "01_ground_pedra_variants#3" },
      { "x": 40, "y": 44, "id": 41, "ref": "01_ground_pedra_variants#3" },
      { "x": 41, "y": 44, "id": 40, "ref": "01_ground_pedra_variants#2" },
      { "x": 42, "y": 44, "id": 41, "ref": "01_ground_pedra_variants#3" },
      { "x": 43, "y": 44, "id": 40, "ref": "01_ground_pedra_variants#2" },
      { "x": 44, "y": 44, "id": 40, "ref": "01_ground_pedra_variants#2" },
      { "x": 45, "y": 44, "id": 38, "ref": "01_ground_pedra_variants#0" },
      { "x": 46, "y": 44, "id": 39, "ref": "01_ground_pedra_variants#1" },
      { "x": 47, "y": 44, "id": 39, "ref": "01_ground_pedra_variants#1" },
      { "x": 48, "y": 44, "id": 38, "ref": "01_ground_pedra_variants#0" },
      { "x": 49, "y": 44, "id": 38, "ref": "01_ground_pedra_variants#0" },
      { "x": 50, "y": 44, "id": 39, "ref": "01_ground_pedra_variants#1" },
      { "x": 51, "y": 44, "id": 40, "ref": "01_ground_pedra_variants#2" },
      { "x": 52, "y": 44, "id": 39, "ref": "01_ground_pedra_variants#1" },
      { "x": 53, "y": 44, "id": 41, "ref": "01_ground_pedra_variants#3" },
      { "x": 54, "y": 44, "id": 38, "ref": "01_ground_pedra_variants#0" },
      { "x": 55, "y": 44, "id": 38, "ref": "01_ground_pedra_variants#0" },
      { "x": 56, "y": 44, "id": 38, "ref": "01_ground_pedra_variants#0" },
      { "x": 57, "y": 44, "id": 41, "ref": "01_ground_pedra_variants#3" },